PRODUCT STORE,Contact,Gaby,gaby@turning.io,All you need is love
PRODUCT STORE,Contact,Arturo,arturo@icloud.com,El unico modo de hacer un gran trabajo es amar lo que haces
PRODUCT STORE,Contact,Alex,alex@turning.io,Cuanto mas duramente trabajo mas suerte tengo
PRODUCT STORE,Contact,Monica,moni@gmail.com,Escoge un trabajo que te guste y nunca tendras que trabajar ni un solo dia de tu vida
PRODUCT STORE,Contact,Veronica,ronnie@turning.io,Para tener exito tu deseo de alcanzarlo debe ser mayor que tu miedo al fracaso
PRODUCT STORE,Contact,David,david@qaminds.io,Simple is better than complex.
